ID,Manual Coding,Tweet
10222,4,Power was up for an hour last night. Still not back now. Will we be less of priority now since less homes affected in the area?
26454,2," every neighborhood around me has power except my street. No down trees,no broken lines, & we got a lift station that needs power"
5943,2,"I get that, but what about the dangerous live downed powerline in the back yard when the rest of the neighborhood is with power"
4311,6,"Thanks  ! It was a long, hot, & stressful six days without power but I know you were working hard to get us back!"
10968,8," Didn't have power Sunday or most of yesterday, finally got power yesterday night, and now it's 3:30am and it's gone out again"
24509,4,when will I get power in Bartow. It's hot.
24669,4,Please make assisted living facilities a priority. Golden Pond on 402 Lakeview Rd Winter Garden needs power!
15952,4,please focus on incident 2005406915 it's extremely dangerous out here without power. It still shows assessing! Help us please!
27644,4,if my power is flickering on and off does this by chance mean you guys are working on I?
1210,8,Not where we're at Everyone in our hood got power back except the school. They've called and we're told FPL would call back 3 weeks no power
23314,2,I really wish you guys would do it sector-by-sector and make sure everybody is actually getting power restored as quickly as possible
23889,4," I don't think it's asking to much to want to why at our house the powers out, and to say ""we're working on it"
15578,2," OFFICIALLY DAY 3 NO POWER, NO UPDATE, NO CREW IN SIGHT. 32205. Myra st and willowbranch. Turn our power back on there is no dmg"
8678,4," PLEASE come to West Park, we're going on day 3 with nothing. All cities surrounding us has power, please help."
15544,4,When will power be restored at 3877 windridge ct 32257?
8992,4,any idea when power will be restored on 69th St & Harding Ave Miami Beach?
4854,2,"Why did the number of customers in Miami-Dade without power go up by 5k between 9am and 10am? Pure incompetence? Laziness? Liars, all. "
22977,4,We need minimal work to get our power back! Why not just make the simple fixes as fast as possible then tackle rebuilding Tampa bay?
8278,2,"3rd night with no air conditioner done, come on  I want my power back on TODAY not by the end of the weekend!"
27132,4,"Mother on oxygen without power for 24 hours now in Whitney Lakes....  , we need power ASAP!"
9914,8," tree entangled in power line on Jog Rd just south of Celebration Blvd, across from Apoxee Trail. "
8627,8,literally melting since one day before #Irma still no power 33137 Miami Fl
23295,2,"No power yet no sign of a truck, heck had to put a sign up in front of subdivision saying no power..around the clock service yeah right"
16656,5,855-398-2370 is a  claims number going viral. We verified that food loss from a storm cannot be reimbursed. Contact your insurer.
9456,4,please restore power to the area close to the hospital in Port Charlotte and prove that property value doesn't dictate priority.
12992,8,Lies and more lies. Last six hours without storm nor even a 5 mph wind. Still no power in boca raton. Please don't miento people.
5541,4,Everyone in ormond by the sea has power even next street over get over here I'm not waiting till 11pm Sunday to have power this is crazy !
15293,4,why is Ortega Forest not on your outage map? We still have downed wires and no power.
23274,5,Did your power drop again recently. If it gets turned on and cuts back off that just means there's another problem down the line
13629,8,More than 2 million customers without power in #Florida as #HurricaneIrma moves through the state. #HurricaneIrma
27965,8,".  has 4,500 crews on standby across the Carolinas, with 150 headed to  this afternoon for damage assessment."
342,4,Is there a website where I can see the neighborhoods that are without power right now?
26018,5,"Bright side: Most of TLH has power so those residents won't be hunting down generators, gas cans, and water. "
476,4,going on to 8 days without power. Can someone check this out Parker street area there's power all around us
16284,3,I'm amazed what utility co. can do to create these win-win situations w/ their customers I've heard hot water tank timers are next. True?
20751,2,WHERE IS THE POWER WE WERE PROMISED BY MIDNIGHT DUKE ENERGY?????WTF!!!!
2902,6,thank you #fplcalvary #fpl #power #restore #workinghard
4276,8,Yeah we've lost a big amount of food bc of the power outage. We have not seen any trucks or people fixing anything at all in our area.
27591,2," we are almost 24 hrs without power, when you turn it on hunters creek?"
28181,8,Down to only 400  customers without power. 300 are in the NW between 34th st. and I-75.
1578,8,Because they can't do anything after an emergency if the document is not notarized
14439,4,any chance you can help out  get the power back on in West Orlando? No DE trucks seen in ORL since Irma!
6210,8,THIS is the order that  is using to determine who gets power restored first:  bit.ly/2fduWeA
24718,2,says a week to assess the damage? No tidal surge and still no power. What are you doing to fix their cluster f*ck?
25143,8,Latest via  on total restoration times (latest possible estimate) - Pinellas/Pasco: Midnight Fri - Currently 1M w/o power #WTSP
20693,2,"It's 3:15 am on Friday Dukey where's my damn electricity?! By Midnight Friday you say, yet here I am... no power and it's hot as fuck!"
13433,4,Dear  I would greatly appreciate your efforts to restore power in Doral FL. Doral Park Condos... Regards... #Irma #Outage
25082,,can you please delay electricity to come back by sept 14? i'm not ready for having power yet. thanks.
860,2,"Hey  what the fuck? Your truck pulls up to neighbor's house, it leaves and now my power is out. No notice/call/message? Bullshit."
24705,1,Spin control. This storm was expected to be way worse. You are a Mickey mouse company
1466,8,We're continuing to help  restore power to customers affected by #HurricaneIrma . Here's another look at what our crews have seen.
23263,8,My while fucking town is powerd. Every traffic light in ia powered. Businesses powered. No residential power. Get out of here w lies
20731,4,power is off on 80th Ave NE in St Pete. Can we get an estimate on repair?
27423,4,u have power?
1686,2,We are trying to stay positive! Where are the trucks?? No power 72nd ave and 134th street. Come on
28094,2,"Oh I have been following it. Since you guys refuse to restore power to NW Gainesville, there isn't much else to do. #Forgotten"
5433,2,Thank you. I'm still waiting for my electricity. 5 days w/o power already.
7717,2,If  had a competitor they wouldn't be so horrible ... a month without power for Wilma and still no power now
8401,4,I know you're busy  but I've got a few months worth of insulin that's gonna go bad if I don't get power soon.
23756,4,You win. It's my bday this weekend. I am using my bday wish to ask for electricity to my house. #OneWish #Power
6597,8,Lmfaoooooo I have power now crazy gyalllll
19228,2,Due to weather? You mean the extreme heat? We are well aware because we are living in it without ac or fans!
6350,4,"Day 5 no power-our food is spoiled, our money is spent and we are desperate for AC. Please restore our power!"
14868,8,the outage map shows that my house should have power but we do not!
23062,4,"Not us! On a well. No power, no water! Used up our 3 day rations. HELP! SEMINOLE COUNTY LONGWOOD."
26815,3,But let's make a big PR show and then not restore any power.
1901,8,I slept like a baby last night since  restored my power. I woke up every two hours wanting to suck on a titty/lol
26854,1,.. Dirty  is wanting families 2 pay 4 clean drinking water. We did nothing WRONG here.
4315,4,Finaly our Power Lineman get some kind of recognition. They need national recognition  . What are you gonna do about it??
22246,2," over 100 hrs with no power in Orlando, in sweltering heat, no idea if Duke Energy even cares if we're here, alive or dead."
9090,6,"Hey I was right, power was restored! To all the houses around my house and 5 of my neighbors, great!"
22065,4,#hurricaneirma  can you please help tweet my mom's senior park day 5 no power no food or medicine another 5 days
17220,8,We never truly lost power here. We just kept having surges and with everyone I know not having power it was scaring me. Osceola is good.
6518,6,So happy that my power is back on! Thank you so much
11935,2,TELL THAT S.O.B. TO GET MY POWER ON. ITS 200 DEGREES IN MY APT.
12587,4,is someone trying to restore power for all the people living in 33312?
10104,4,what's the estimated time for Deltona to get their power back ?
13573,6,I LOVE YOU  THANK YOU FOR GIVING ME MY POWER BACK
12273,1," since you guys can't give me an estimated time as to when my power is coming back, I'll do the same when I have to pay my bill"
9164,4,We're still out because you're powering the rich neighborhoods. Stop being stingy and give up power in Garden Woods.
9171,2,why y'all got 100 trucks just posted at Magic city casino when million of houses still don't have power?
16793,8,You scumbag Liars! Osceola is not full restored. On day 8 with no power. Media and State Senators have been notified. Go to hell
13910,8,"There are a lot of people without power in Boynton Beach on 23rd Ave & Federal HWY, 23 Rd ave & seacrest. #Irma #IrmaPalmBeach "
11704,8,Large teees hanging on power lines in Estancia (on Glades Road  feet from Powerline Road) in Boca Raton
15632,6,Celebrating the power returning. Thanks  and  .
9674,2,33173 NO POWER FOR X4 DAYS
22145,2,Had a bucket truck and a pickup restore power to everyone but my street last night. Wtf is going on here
27597,8,Passed 22 hours without power. :(
11991,4,US HWY 441 in canal point needs power newborn babies and elderly out here the surrounding areas have power
24056,2,Tangelo park Orlando FL have no power wen international drive has power I have a 2 month old who is getting sick cause I can't warm bottles
15577,4,"Does anyone know what ""crew status restored"" means on their outage map? It can't mean power is restored because power is out"
3124,4,how about getting my power back on for my birthday?? I live in fort Myers off mcgregor north of the golf course west of mcgregor
20378,2,All of my family (live right by the entrance of the KEYS) have their power back on. I don't because I have  . #FireDukeEnergy
9299,4,...do you have power?
13596,8,.  reports more than 2.3 million customers without power in Florida as Irma hammers the state  wapo.st/2vX3EDT
1516,4,are you working in Crown Pointe East Naples yet? Houses still no power.
1932,2,Day 9 no power!!!! Neighbor had a heart attack. Haven't seen anyone even working in our neighborhood. It is grim in Fort Myers.
18026,2,And wouldn't that mean if I'm still without power they will once again knowingly miss their self imposed 1159 Pinellas County deadline?
10894,0,Hurricane Bae might need to work for  . Y'all got any single men in northeast Fl? Asking for a friend. He must love God and cats.
9510,6,Thanks for the hard work. Do you have an ETA on Brevard County specifically Merritt Island? Have has power 1/2 doesn't
17123,8,Power finally restored here in St Pete after 8 days. I hear people cheering in the streets.
10220,2," I know you guys are busy but please, everyone around my street is up.We all have well water so no power=no water!"
26904,2,This is ridiculous. I lost power at 12am and my power came back on at 6:20pm and went off 20mins later. Whats up with the power
18504,1,You can't tell if we have power or not and we're supposed to trust you with a nuclear power plant? #DUKEENERGYIRMAFAILURE #isthisajoke
4566,4,can anyone explain what this is and if it's causing our power to not get fixed as of yet?
15313,1,And now we're not even showing on the outage map as not having power. Cmon  y'all need to start communicating better
27223,6,The moment when  puts your power back on #hurricaneirma #youguysarefast #ThankYou
11168,2,Y'all can imagine how frustrating it is that you see out your window and the people across a small lake have power and I don't
18737,2,and i am 5 house from a substation ans havnt had power since sunday night...going on 6 days
20018,5,"I understand you're angry about the power outages, but I have a feeling you have no clue what you're talking about."
27446,3,#Clearwater & #Largo no power going on 24 hrs. No one from  any where near. Customer service sucks. Better have to pay for this.
11512,2,all the streets around me have power while my street is still without it.
19449,1,2) If you couldn't get us power you should have told us earlier so we could plan. The heat is bad. Your lies make it worse.
14228,4,When is the power going out?
11522,2,Ain't no way y'all brung all these people and cutler bay still don't have power
4325,4,Please look into why  is posting that people's power is restored on their system when it's not true. Fudging numbers?
3463,2,My outage is not from damage. It's human error. Crew did not reset my Transformer.
14046,2,"Just a gentle breeze here and the power's already out. This is gonna be a rough ride, eh,  ? #hurricaneirma"
18710,2,apparently i’m the first to report in my area for power outage?? how the hell is that accurate?
11851,2,"Welcome to the club.. 29 hrs and counting.. no power in Miramar,Fl.. this sucks, oh well."
16753,4,I'd love to give some kind words if you can give me some power in Pinellas! #freemonthofpower
7953,4,not to be pushy... but when is Melbourne/Indialantic power coming back?
25171,8," 2 Trees down and on power line blocking half of 4 ln rd, 22nd Ave N & 53 St N Pinellas 33710 creating hazard, timeline???"
17724,2,still no power day 8. Called hotline AGAIN & put on hold. Wasting precious cell phone power holding. Evil #DUKEENERGYIRMAFAILURE
1032,2,"N here s the broken line. Twice the update said""Power Restore"".I had to file new reports.They think GOD comes at night to fix their problems "
19810,8,The biker bar 500 yards away from our house has plenty of power. Our neighborhood? Hell no.
2888,4,I really need my power back on I want to cry
14961,4,"As awesome as  is is as awful as  is. Come on, cable/internet isn't as hard to restore as power, is it?"
26738,2,over 24 hours of no power !!! duke is the best
9799,6,Great job  &  taking care of the City after the storm!! Also thank you  for your efforts!!
12117,4,How about some power????
5660,6," I know you're working hard & we thank u for ur dedication. We think this is part of what has our power out. Oakland Park,FL 33334 "
8928,4,our app said we have power but our office is still down! Breaker reset did not work! 4700 W Prospect Rd Suite 115 Ft Laud 33309
18880,6,Thank you to all the Electrical Trucks from all over the State & Duke Energy for coming to our aid after Hurricane Irma!
21424,2,I want power so my dog can sit in the house and not die. So I can lay in my bed and not fear having a heat stroke as you take your time
23596,2,"This is a flat out lie, stop with this BS! Nobody in Jefferson county has gotten power back."
13515,2,I swear  better not make us wait as long as we did for power after #Matthew or I'm gonna go apeshit crazy on them!
8452,4,I swear... can you just please turn on the power...
19861,1,Have you been to the public meetings involving upgrading the power grid? Citizens in favor or upgrading are typically far far outnumbered by
25941,4,updates on North Pinellas? Everyone around me has power?
8301,2,Stop tweeting and get people their power back! My poor grandma is suffering in this fucking heat and the street in front of mine got power
19089,3,.  I'm am going to report u to the state  this is bullshit price gouging this is we don't even have power
15376,6,Thank you for restoring our power on Dunmire Ave!!!!!! Thank you! Gracias!!!!! Gracias!!!!
18848,,Duke is the Power Company
18469,2,Great job keeping my power on during #Irma ! Not so great I lose power 5 days *after* the storm
22372,6," Yes, we have power! Thank you!"
2855,2,doesn't care about their customers. Still no power is ridiculous. Lack of care = lack of power! Terrible.
25194,2,I love how this still shows up in my email after almost 48 hours with no power  #wheresdukeenergy
23700,2,Lokanotosa only road off of Rouse Road w/o power. bogus
12489,8,We're going a bit crazy without power but holding out. Will probably have to toss everything in the fridge :(
7897,2,That's great however lost power on Sat and still none. All others I know lost later and have power. Doesn't make sense.
20648,2,power out Sunday the 10th at 17:00 today is Friday the 15th no power.
25547,4,.  ...I promise... if you get my power restored in Longwood/lake Mary FL today I will bake & deliver you all homemade cookies!
4680,2,"Ticket #290, no electricity, no water (well), 21 miles from town, and trapped due to this tree laying on a powerline and blocking our road! "
12684,8,Our 400+ member crew is headed to #FL to help w/ Hurricane #Irma – part of the largest restoration workforce in U.S. history. RT
11189,6,I think anyone rude or inconsiderate on this post doesn't deserve their power back yet. ~
25767,4,is there any updates on how long power will be out and don't give me that broken website
5686,4,Come fix Miramar power is a fucking hotbox over here
22724,4,We had power at the Bradford Cove sub division on University then you took it away last night. Please give it back!!
3024,4,My neighborhood still has no power! I want our power back in 33168! I can't spend another night in a hot house! Please!
14370,2,Just received a call from  asking us to report power outages online during Irma. Without power it would be hard to report it.
12918,5,Florida Power is  not  just FYI
18561,1,You are right this is unacceptable. We need to create legislation on power restoration expectations.
21158,6,Shout out to  for working around the clock to finally give us POWER #HurricaneIrmaRelief
4972,8,Neighbor put up guards so people won't run over it. Today is day 5 without power :(
1283,3,The level of incompetence in running customer-facing operations is off the charts. I think FPL believes *it* is the victim of the storm.
20335,4,still no power in my neighborhood w no damage. ppl are getting ill. Survey was here Monday. Plz help us!
22949,4," Im in Clearwater in bay cove apts. can you even tell me the cause of my power outage. Down pole, tree on line, trans stn #power"
19824,4,when are you fixing Madeira beachs power!
21835,4,How is it that everyone has power in my area except 4 houses on my street? Can someone please come back. Can't get live person on the phone
10493,2,"Where are your 'regular updates?' You've told us NOTHING! You are incompetent! 48 hrs w/no power & no info. Way to suck, fpl!"
352,5,Hope all the crews are safe out there while trying to restore power to Kissimmee.
23713,8,"From  : Central/Northern service areas (Hernando, Citrus, Polk & Marion counties) should have power by Sunday, Sept 17th. #Irma"
28106,2,"Your crews are no where to be found in NW Gainesville. Either forgot about us, or don't care. 7k total without power, half are in NW GNV!"
19778,3,Were you among the  customers whose recent bill skyrocket...  tampanews.co/were-you-among -the-dukeenergy-customers-whose-recent-bill-skyrocketed-via-saradinatale/ … #TampaBay #power
20787,5,"Again, refer back to my tweet.Not saying ALL Duke energy customers don't have power & im not saying Duke customers are the only 1 w/out it."
20494,3,".  sucls. Still no power. Their phone msg says text 'Status' to 57801. When I do that, I get 'Access denied' What a crap company."
1269,4,Please send to south east florida as well!!! Still no power!!!!
15614,4,How many people live in downtown compared to Avondale without power??????
16777,2,Your best isn't good enough. Yes we know how much damage there is but we expect you to be able to handle it. You cannot.
26510,4,"74th St N and 46th Ave N. St Pete, my parents are without power this could be the problem #HurricaneIrma    "
1659,2,Still waiting for answer on why crews were removed at 130 pm. Still waiting and still no power!!!!!
17703,2,This is incorrect. Saw power guy yesterday and they went home at 6:30 PM
14523,6,Omg omg omg!!! Thank you to ALL the linemen putting in the extra hours! We just got power back!!! Thank you  !!!!!!!!!!
8985,2,"So dangerous snapped power lines are less important than getting ""the masses"" up and running."
16946,2,couldn't sleep in the heat. Still no power. Still no info from  . No explanations. No responsibility
13525,2," A squirrel could fart and my house would lose power, how is it already off? It's barely raining and hardly windy; in the trails"
21853,2," another day, another couple grand lost, both offices and home still out of power. This is a pathetic response. Petition time."
8716,2,mi wan mi bloodclaat power back right now mi cyan tek it anymore
1938,5,Was just messaged that some in Coral Gate have power. Do you yet?
3703,2,Congrats  - I now have elderly patients clinically dehydrated bc their nursing home has no AC or power.
18201,2," 7pm no power on south Jeffords st and the crews quit at 9. Feeling like 1159pm tonight is, like yesterday's promise, bullshit."
5536,2,No han puesto aún power en north miami la 8 an y la 146th st aún está sin power desde el sábado que barbaridad
5584,8,area north of cc elm still w/o power
19933,2,Wow..heaetstrings...wait didnt people die because of lack of power due to Duke.....tears are gone...  petitions.moveon.org/sign/eradicate -duke-energy?source=c.tw&r_by=18768070 …
22938,2,All those trucks and still no power. What a suprise.
23284,8,"From a peak of more than 5,600 power outages in the county yesterday,  now reports 1,576 remaining "
4181,8,"the 6 trucks in my area today are all gone, I have little kids and still no power. #poweroutage #Hialeah #frustrated"
14448,8,And we're still w/o power five days later. Had to go to a hotel because of this brutal heat!
27693,2,Tomorrow?! Meaning power isn't being restored at all today?!
22104,2,We have watched as power has been restored to everyone in our vicinity but us. I have yet to see a single truck in our area.
9798,4,do you guys have a estimate of when everyone in Jupiter Florida will have power?
19961,2,Another bullshit lie. Was told by 1 of you cheerleaders in a Ford Escape you will not be getting power that day if it's not up by 7pm.
4031,2,I don't understand how 5+ days into this there's no update. Also we lost power 9/10 at 4pm. How was it reported 18+ hrs before?
2876,2,can't believe there is still no power. we are on a grid of 42 homes/businesses. HOW ARE WE STILL POWERLESS?!
12933,6,Thank you  for keeping us with power through out #Irma . No easy feat!
18461,8,UPDATE - this is the latest power restoration info from  re: counties/areas/timing  #HurricaneIrma #IrmaRecovery
8219,6,"Thank you for ur hrdwork! called FPL but they said this is NOT an emergency. it is by my entrance, neighbors are concerned that WIRE giveway "
15270,2,outage map shows power on at Woodelm and Applewood but it's not. NO #JEA TRUCKS IN SITE
24965,2,Seminole county in Oviedo on the Park. Sunday? Really? No damage.
4637,2,"""Power will be restored to the entire east coast by the end of this week."" Stop giving false hope! give us legitimate answers. "
13823,8,Half of  is without power.  will have crews from around the country working as soon as winds die down.
25960,4,A lot of us off NW Sagamore Ter 34083 are still without power. Please assist us ASAP. #Disabled
4561,8,Updated power outage/restored list in the state of FL.  will have everyone on east coast power on by this weekend  .
21335,4," he had power and now we dont? in fox hunt alafaya trail, 2717 gray fox Ln, orlando 32826"
19558,4,please turn my power on I'm 32 weeks pregnant and been without power for over a week now.
26101,3,why does a dance studio barber shop etc deserve to have power over myself and family how does that make sense! All bout money
7544,,FLORIDA POWER AND LIGHT
15595,6,Got home from dinner and my power was back on. Way to go  !
14864,4,"Phone line gets cut off everytime, power has been off in Harper Grand/Mausser Dr 32822 for 2 days. Very hot and food has spoiled. Plz Help"
13693,4," we lost power 1:47pm 700 executive center drive, West Palm Beach, Fl 33401"
9715,1,.  no power for most houses. Outdated electrical grids and power lines are largely to blame for the stupidly unnecessary delays
19520,4,This spreadsheet is all lies!!!! Why should we look at lies. When is the power coming back? Give people the truth !
21651,4,hey are you guys going to give a credit on customer's electric bill since we've been without power for almost a week in st. Pete
2715,8,"You'd be surprised, a lot of us down here still without power"
4831,5,OMG. Wow. That's crazy. I really hope you get it back soon. Fpl is hoping vbyvtye weekend Al should have power.
10098,4," please restore power southern brevard beachside.we have well water, no power no water.Using pool water to flush toilet!! No water"
21916,2,"How long can it possibly take to ""assess"" damage on a storm that passed 3 days ago and has been safe to start working ??"
7856,1,what private utility would install billions in capex in a lowland swamp that floods annually
22478,4,give Greenbriar power and I promise to stop tweeting
28077,2,get your act together! Stop prioritizing and get power to the poor!!
27921,8,Power out in the villages Lady Lake area of Spanish Springs.  #IrmaHurricane
12355,2,Thats sad because the hurricane didnt hit miami dade and broward but we had power outages
7114,1,BS!! You guys have had at least 12 years to prepare for something like this...and truly been more than 25 years since a similar styled storm
26532,4,"No power in South Orange, it said 413 residents affected, no trucks on site, we have elderlies here, please respond quicker"
13410,8,"#Poweroutage update  reports 112,820k  customers w/out power of 263k customers up from 34k "
1066,5,You're still out of power?
