ID,Manual Coding,Tweet
6598,4,"33157, power please..sometime soon. Like tomorrow."
6049,8,I hope you don't show the Lexington Club as having full power. I and my neighbors are still our. 7641 Lexington Club B.
7317,4,I still have no power  come to lil Haiti
26396,2,OUC has restored so many residents in Orlando Altamonte also has power. We had no damage in our community just no power since 5pm 9/10/17
1632,2,We are STILL the only folks with no power in our neighborhood. 2 TICKETS FILED. Fix it. West Park
4889,2,Alright  it's been a week now and ppl around me are getting power. Speed this shit up man I'm over it.
14469,4,hi our power was restored yesterday but just went out again st 12:45am at 5410 Lido St 32807 what do I doSystem not updated
16709,8,Could've but power was back on 12 hours then went out with no Duke in sight. So either it blew or fell out but no damage apparent anywhere
2732,5,you get power back yet?
27418,2," going to set a record for slowest response time & killing more people than storm. Elderly, children & pets at risk. #AfterIrma"
23060,5,Pretty cool. Free beer at my house for the Duke guys if they get my power on for Wheel of Fortune. Tom Johnson will bring the wings..right?
6209,2,Still no power 6 days now. 33435 everyone around us has power. WTF ? Did you forget about us? Say your still investigating the damage
4476,2,"Still without  power, when everyone for a 10 mile radius has power. The difference? The 50 homes that are out are poor people....."
4577,8,your workers left a live power line that could've been fixed in less than an hour on day 3. So a contractor to fix it on day 6.
4739,4,"Please send someone to 15th and Meridian there are children, pets and cancer patients in these buildings. We have a power line catching fire"
24309,8,"In my case, it's not even that it's hot. It's DANGEROUS!! Downed, snapped, exposed power lines down on my property and all over Deep Woods!!"
11533,5,Retweeted FPL (  ): Stay away from flooding caused by #Irma . Standing water may be hiding downed power...  fb.me/zXqC8p5m
13125,8,Arium San Reno apartment complex power is out in Coral Springs.
22778,4,Haines City Health Care Nursing Home is in desperate need of power.
19459,4,I'm looking for Orange County where's our power at
21201,3,"It's the lies being spewed. I wouldn't trust anyone from Dook to mow my lawn, much less anything power related."
8418,6,Just kidding about the whole sitting with no power for a month  . Bless me whenever you're able. Love you guys. Rooting for you!
1960,2,So this is why my sister will be without power for another week
18322,8,"I couldn't agree more with Mr. Johnson. We just got power today, however, we've also been w/o water."
13114,6,"70-100 mph winds, still have power AND satellite! Kudos  and  . Stay safe everyone! "
19246,2,The communites you list were flooded and torn. Many low income areas are in better conditions and easier to restore though still ignored.
9833,4,"I live in Titusville, but evacuated. If you don't mind, what part of Titusville do you live in as I'm trying to see if I have power back on"
16685,3,Who ever runs the  twitter account should be fired for participating in spreading lies about power recovery times.
8743,5,Ana your truly luck your house wasn't destroyed by falling trees
28109,6,Hey  -- my power is back up. Huge thanks to all your hardworking employees for their efforts. You get an A+ from this teacher!
13614,4,how do I get that fpl power tracker app?
27118,2,So our grid that's on the same one as an elderly home with 100+ residents has to be without power for a week? Unacceptable
24522,2,the people directly in front and behind have power but I don't. The heat really tries my understanding of why.
7468,2," 's birthday is on the 16th and my birthday is the 18th, all we want is our mf power back "
20536,3,how come CEO raises every year but no improvement to power grid? What are my rate increases paying for?
18806,4,Website says my power is on but it's not. I keep reporting it it keeps saying it's the first time it's being reported. What can I do?
5701,8,TFW  has your power back on. #IrmaRecovery #IrmaCleanUp
17164,2,WTF  ? 5 days wo power. 1.5 days with and now we're out again
23325,3,Lining their pockets with profit instead of upgrading the dilapidated power infrastructure.
249,8,I still have no power
10246,8,"Power to South Florida homes could be restored by end of weekend, according to  ."
20374,2,110 hours with no power.
2838,2,Still no power! Well my electric bill should be lower this month!  #HurricaneIrmaAftermath
11104,8,Irritation the electricity was out (36 hours) vanished when power came on at midnight. 1/2
9219,6,I got my power back. Thank you. Please post links about heatstroke and heat exhaustion - I am extremely concerned about it.
19316,5,also do they have cooling centers for you guys that don't have power?
582,4,I live off Dossey road - thankfully they saw my tweet yesterday & did have the tree blocking us in cut away. But PLEASE restore our power!!
10516,6,Thank you for getting our power back on! We appreciate all you do for our communities!
21251,4,"I have reached out to the RedCross, Emergency Operations,    . Residents keep calling for help 2/3"
3859,2,Hv been looking forward to #lplsimulcast for wks but won't be able to due to no power bc of #irma
5761,8,No power here in 33168 at least not my house #electricityisanecessity
11938,2,"Did it done that  :17 yesterday. Still no Update, worst, NO POWER! Not paying fpl to inhale fumes from neighbors with generator. Tkt #9647"
19289,2,No power for 6 hours now
4974,2,"5th night with no power, HASTA QUANDO?!? "
21657,2," your lack of communication/response after Irma is disgusting.4 days going on 5 w/o power, still no answers of when. #fail"
3175,3,Again a generic mg that does not address anything nor shows you read that theissue was reported prior to the hurricane. Sat
24125,2,The power shut on and off fast. Don't play me like that  i've had enough mini heart attacks for us all in the past five days.
6971,2,"I need a discount     I have been w/o da 3 key essentials in life..power, cell serv, & cable for days"
20570,2,Ha. I haven't complained yet bc there are people worse off than me but 5 days without power is starting to get old.
26953,2,I get  is working they're hardest to get power back to us. But it's upsetting when you're the only building in your complex & (1)
3125,6,You guys are our superman/women! Thank you for what you do! My wife and I have offered water whenever we see you guys. Keep it up !
11141,6,Our power came back in time for breakfast. Thank you.
7546,4,Power trucks nowhere #WiltonManors and we have downed lines hanging. #RestorePower #Irma
20222,5,I spent a week in the same conditions!!! I was with out power for 5 days also.I lived through it so did my kids & dogs who fart also. Alot
9050,6,Appreciate all the hard work that u do. R neighborhood in Lantana has power across the street &behind us. South side of Flamingo Dr doesn't.
18856,8,Your outage map says we have power - we don't. Entire neighborhood still out. 32725.
4618,2,.  No power for six days. No updates. No responses. They keep posting PR videos with inspirational Muzak.
11205,3,"Are You Serious!! There is absolutely no and I mean no, communication from FPL on when we will ever get our power back on, none. Shocked!!"
25127,4," staging area just down the street, power still off. Look behind you and notice us instead of ignoring our plea."
8485,1,Aye  weren't you guys supposed to shut our power off to avoid this damn problem? Like cmon
21113,2,why is taking so long to restore power in Palm Harbor area? I've seen several duke energy truck in my area.
6227,3,"But power doesn't have to go out or stay out. Brickell had power back in 2 days, as did many other areas. FPL needs to be held accountable."
27379,3,just called to let us know they have to assess the damage. #excuses #insulttoinjury
22071,3,Wow! Such a competent power company! All about their customers in times of need. Bravo.
14054,2,barely any rain and wind and we already lost power for over an hour. With no signals of getting it fixed soon. #veryefficient
26129,2,"It would be one thing if Pinellas Co. experienced heavy damage, but it didn't. This is unacceptable "
21852,6,"Power is getting restored in Sebring, Thanks to the fleet of contracted trucks with  from all over USA for #IrmaRecovery effort "
576,2,(4) We throw $1000 value of food still don't know when will get power. LET'S BE HONEST WITH US AT LEAST WE CAN PLAN ACCORDINGLY
4426,6,"Thx 2  4 restoring power 2 Sunrise Community, which is home to 120+ disabled kids and young adults. 7 days w/out power was brutal!"
16073,4,If we live at NS Mayport do we contact you if our power is out?
28137,4,"Still no power, looks like we are close for the night. Any update on midtown  ?"
15064,4,how can customers receive updates on power restoration
23598,,Retweeted WYRZ 98.9 FM (  ):  is the proud sponsor of  weather at 10:30 AM...  fb.me/6tMfHDWts
15919,6,"POWER. Thank you, sweet infant Jesus, and  employees everywhere!"
5553,6,"Thank you FPL! Power restored today. Impressed by the organization, communication, customer service, & pace of this effort. Happy wife! "
22904,2," power came back on  in mount Dora, FL Florida and now without warning at 5pm its out again and can't get any answers"
16742,1,I think they are not equipped and afraid to admit it. They have never been in my neighborhood assessing the downed power line.
20530,3,"People finding they've been marked complete and still w/o power, how can we trust the deadline or database to true? #DukeEnergy"
24181,2,Please help Central Florida get #whereisdukeenergy trending.  is refusing to restore power for Florida customers.
23576,2,#TuneInNextWeekWhen I might have moved out of my apartment to avoid failing my semester since  refuses to power up CFL.
8438,4,22631 sw 88 pl.cutler bay 4 days without power please hurry up!!!!!
8717,2,Fl based companies like FPL have restored most of their customers' power. Im in LK Mary & still don't have power. I'm a Duke Energy victim
16739,5,team member: “They won’t tell you the truth. They won’t even tell me. I don’t know when you’ll have power back.”
16354,6,Got power two days ago! Thanks to Pike Electric from NC! Duke Energy just withdraw without fix anything till Pike comes next day.
6653,5,Just a suggestion: after essentials are restored power companies should focus on areas on well instead of city. No power means no water.
28182,4,power at at SW 107th Dr. already called in. Hoping for quick restore?
25775,2,What are they working around the clock to do? Nothing is being done. Over 1 million people still w/o power. Get off your asses.
1912,6,NMB Water deserves a lot of credit for maintaining safe drinking water throughout Hurricane Irma.
6325,2,the heat here in FL-temps 90's-& having no power/AC is sweat heaven. I haven't seen any utilities trucks in my area at all.
20712,2,"It's hard to see the clock they're ""working around"" without power. Duke blows."
11764,5,Do u have power
14607,4,when will power be back on palm lane? Many small children on this street. #ouc #pleasehelp
25208,4," is there a reason OUC, Kissimmee Utility, FL&P all have power back but u guys are ""assessing damages""??? What gives?"
13802,8,"NOW:  reporting more than 1.3 mil in #Florida without power. Most, of course, in south FL; In #Volusia , only 30 outages. "
8336,2,"Haven't seen a single power truck in Lee County, Fort Myers and it's Wednesday morning.  #IrmaRecovery "
9379,4,hey... fix our power in the 33128 area... this is ridiculous that we have to wait until Sunday That almost a week with out power
25603,5," is sunny, covered in seaweed, and the perfect place to spend the day while  is repairing our power lines. "
19426,,From the folks with electricity.
5117,6,Thank you  for getting our power back on!
6779,1,Street lights and a billboard lit up like a goddam Xmas tree out my neighborhood but no power for us. Archaic infrastructure + monopoly
18098,2,Another job. That they are wasting time driving. & people in their neighborhood have power but they along with others still don't.
8381,6,I can't say enough nice things about  and all the linemen working around the clock to restore our power!! #thankful
10202,1," 11 days to get power back in Port Charlotte Florida? Thats as long as it took during Charlie.... 2017, and youre still pathetic"
1668,2,My mom didn't have to evacuate from hurricane Irma but she is now evacuating from  incompetence.
26389,2,They were restored because they weren't on last night. I see some homes nearby have power but it's been 31 hours for us.
10433,3,FPL is full of lies! They are in Miami helping not Briward or PB county where power is out! Your website is a joke! Waste of a company!
23276,8,The apartment complex Wentworth apts on lakeunderhill & Dean in orange county has been out of power since Sun 9 pm 2k people
5757,4," Here in Fla. My mother in law is staying with me until you turn her power back on. Don't wanna beg, but I will if you make me..."
16608,2,Bruh fpl ain't that good ppl down here still down have their power
4348,2,sure!! thats why we still have no power !
24396,4,Look I'm in ocoee commons and power is up on 95 percent of the area minuse the few neighborhoods in the area. I've had to throw out food
15503,2,"#Thanksjea for that automated answer..This is what frustrates ur customers,Ur Lineman doesn't check a ground box full water and live wires"
16562,6,Kudos to the hard working men and women out in field restoring power. For Duke corporates..... epic fail
13213,8," now reporting that approx. 135,000 out of 263,8000 customers in #Sarasota County are without power.  fb.me/zMGfSLGQ"
9187,8,The buildings are 4 story and no power for elevators
26624,2,So is the ucf area gonna get power back soon or do I gotta finish making this grilled cheese by candlelight?...........
5544,,"False Hope// According to  we have power, but according to…  instagram.com/p/BZCcwN3AkX-y MXUxHBHcK0pN3gDNFkl3GtC8JA0/ …"
19411,4,Well I'm in seminole county and live in the central park apartments five days now and no power I don't want to wait midnight on sunday
27871,4,???? Get a new website manager. 10263 Gandy Blvd N = No power.
7285,1,"Interesting to observe that everybody around my neighborhood has power, but my street not. What's going on?"
23948,2," any chance I get power back today? Starting to wonder if, ""I didn't share a grid with mobile homes would I have power by now?"",,"
19516,2,...everyone around us has their power back on? Please have mercy!!!
11402,5,"Sucks, man. Thankfully our house has power. Should be on soon for you guys; I've seen them hussling today!"
318,2,anyone now if the power is back on 34747
21236,8,"9,000 Duke Energy workers are mobilized to restore power in the aftermath of #HurricaneIrma  tinyurl.com/yd723fta "
2322,8,Only 2% w/o power in Broward
1054,6,Thank you for getting us power back so quickly!! Doggie and I greatly appreciate it
13717,8,coral springs lost electricity
25370,2,That's BS...they're restoring power to the affluent on Clearwater Beach before anywhere else
6747,6,Power to the people! Thank u
8963,2,You guys should of been had them out the day after the storm this is ridiculous!
5490,4,"When golden gate city, Fl power will be restored? This cable is down behind houses of Hunter Blvd "
24843,3,I think  should do a credit for two months for anyone without power....my bills r due to be paid when I'll have no power...
16620,2,day 9 comes to an end and still no power from Duke. Dont forget to update the press release with another fake restoration time
26831,2,Jorge I'm a fan but there's no excuse for this. Our power went out before the storm hit. It's been out for over 24 hours.
20954,4,Just my street. Literally everywhere around it has power.
16841,2,"The hurricane was gone monday morning, they could have used all of the afternoon and tuesday looking at the damage and then getting started."
25912,4,hoping this work will restore power to about 500 in Orla Vista #Irma
9752,4,Status update request 4 power #ThreeMeadows #Rockledge #Irma #BREVARDCOUNTY #FPLPROVIDEMOREUPDATES
19997,2,I just want power :(
14024,8,"Over 26,000 power outages throughout Broward County. Report any outages to  #HurricaneIrma "
28098,2,Thanks. I messaged you on fb. I would really appreciate if we could get some info on specifics of power restoration for that complex
10870,4,No power on Stirling Rd by Davie Rd Ext  any updates as to when ???
27870,4,we have a tree touching the power line. We called and texted to report outage but there was no option to report this.Thx
4964,,Egad! You're right. Meant Florida Power & Light.
12534,4,do we know when are we gonna have power on Zipcode 33027?
9532,1,how aren't you guys unprepared for hurricanes power lines should not be unprotected
7628,4,please tell me why I have not seen one utility truck in my town. No power for 4 days and no relief coming. Zip 32927
24766,2,checked  website and it looks like we're probably gonna be without power til about Sunday night.
21421,2,No Power. Have not seen a truck anywhere in our area.
12205,6,Thank you  for the quick response in recovering power!
6640,6,I appreciate the hard work. Everyone around our older neighborhood has power. Many elderly. Investigating for 24 hrs.
14621,6,- Have I told you lately how AWESOME and AMAZING you are!?!? Thank you for power!!!! #grateful #thankful #irma
10181,8,Power trucks all over #PalmBeachGardens #LakePark #NorthPalmBeach area. #RestorePower #Irma
25919,2,"  no power, no updates from Duke other than assessing damage. No trucks seen west of Apopka Vineland."
22449,2,"While the bot is answering our questions. Tampa electric continues to restore power, OMG it's past 9 PM. GASP!"
12436,2,sooo why the power not on yet????
12435,2,come fix my shit fam the storm has been over and I still got no power
21063,2,Think you have to give the lineman BJ's before they give power now. Get your kneepads out  !
5442,3,"FPL can't leave power on for much so they say restored power but after they tell stupid politicians that , they cut power again"
17270,2," any reason why we lost power again in Winter Park, FL?"
19304,2,"Since St Pete Beach isnt mentioned do i assume we dont get power tomorrow? Worthless update, worthless provider"
23832,8,130 more  workers leave for Florida at 9:30 a.m. to help restore power after #Irma  bit.ly/2jpicGb
12058,4,I haven't seen a single fpl truck around North Miami. 33181 Restore the power asap please.
22024,2,now less than 48 hours to meet your promise to have all power restored in Pinellas by midnight Friday. Tick tick tick
21507,2,day 5 with no power
22789,2,Seco will be the last to get its customers power because they have to wait on duke
13240,6,You rock  - power restored just hours after Irma! Best power company ever!!!!!
16215,,HQ building in Charlotte is like that as well. Kind of sweet really
14147,2,"Well, there goes our power. Reported to  -- is #Irma even here yet??"
27766,2," so how long will it take to ""assess"" the damage?"
22513,6,Power is back Thank you !
21758,2,How is it that one little pocket of homes in my neighborhood is without power but EVERYONE around us is up an running??
2772,1,Problem is: Irma was a Cat 1.5 here and we're still 7 days and counting w/o power. 12 years of improvements DID NOT WORK
23910,8,"LATEST TOTALS: #DukeEnergy has 100,519 customers in Polk. 30,409 have had power restored, 44,503 are still waiting.  "
17188,6,still without power but your customer care Rep Rose = amazing! Even with a deadline delay :( she was a pro u need more like her
5326,3,"FPL executives need to B investigated 4 gross incompetence, 5 days after storm with minimal damage & ideal working conditions, power not on"
7647,2,. for real? Are those real FPL trucks are fake at FAU? Why are they sitting there? We have no power still..they're sittiing there
1495,6,"we appreciate your efforts in restoring power to everyone , what's going to be done about the hundreds of dollars that ppl lost in food"
4359,2,you are responsible for taking 6 days to restore power. Took 3 days before a truck showed up
24151,4,I'm in Polk county when will I get my power back half of the apartments where I live have power and half don't
14265,1,.  : We need to be prepared to be without power for weeks. #IrmaHurricane2017 #FLPrepares
13604,2,I haven't had power since 6am
19719,2,This storm took out a lot of power and everyone thinks that they're more important than everyone else... there's only so much they can do.
798,2,"Their outage map is only reporting 1182, Can you please have them update it.  lakelandelectric.com/emergency-info rmation-center …"
19279,2,Well i officially have given up any hope i ever had for you guys to restore power....how about be p r e p a i r e d next time.
27299,2,Now if only  would get off their asses and hey power back to us.
13447,4,"yo  turn my power on, we good in Kendall Lakes"
13188,4,no power in Heathrow. Thx. #justalerting
22383,2,when #TacoBell stays open later than #Duke Emergency restoration team
4026,2,Um you were in my neighborhood and didn't fix my down power line. We're the only ones without power while everyone has power in my block
14326,2,hello. Will the power be removed before the hurricane? I keep Hearing so. Don't know if real.
24651,2,"That is a week after the storm, really!!!!!"
17399,2," I see you're ""here"" Mon-Fri 8-5. Well, we've been w/o power Sun-Sun 24hrs/day. #IrmaRecovery #altamontesprings"
9821,2,The website is telling people that their power has been restored when it hasn't and their tickets are completed.
3364,2,9days we cut our own trees cause fpl argued whos they were. Give us power now. Office is clueless to whats fixed and not fixed. Discusted
24055,6,".UNBELIEVABLE Is BELIEVING! 27 Minutes after posting this tweet, my power is BACK!!!!!  ROCKS! THANK YOU #MAGA"
27202,2,What if your next door neighbor has power and we don't? #Ridiculous
9671,1,"Hey,  ! I'd love power updates, but your website to turn on those preferences is DOWN. Shame on you! Might want to plan better!"
17370,2,Wish Seminole County / Altamonte Springs had even a quarter of those resources. No power for a week and not a truck in sight.
12653,6,Way to go  My brother's power is back already thanks  #Irma
18321,2,So this would leave half of my apartment complex without power ?? Why would the trucks leave our community without completely restoring it ?
20720,2,WHERE IS our power duke energy we want it now!
3083,6,Thank you  for getting our power restored in the Upper East Side in Miami!!!!
2115,5,You should check online and see if it says your power is restored bcus they did that to us and ignored us when we really didn't have power!!
10688,8,There are downed power lines in Richmond Heights (33176) at Van Buren St & Douglas Dr near Frank C Martin K-8
3886,4,5730 Charleston Street Hollywood Florida 33021 power line snapped my brother his wife and five children ages from2 to 21 Please help them
5748,8,hazardous electric post in street for days . No power one street the rest is powered . St. John Neumann school three poles down
22179,3,"I've not seen one negative story about them, yet there are so many pissed off people sitting around with no power."
25224,2,"#HurricaneIrma was kind to our home- No damage, lost power/water. Will stream again once power is restored! (Lookin at you  !!!)"
26324,2," If you can't fix our power, at least tell us why. Sincerely lower-class apartment complex"
2971,2,"Most of my town has power. Even my next door neighbors have had power for 4 days now, but I still don't..."
15513,2,3 and a half days now. Still no power. Every outage on your map still says assessing. You guys going to give real updates?
14514,2,Can you confirm that the power outage at Narcoossee & Dowden will be restored today?
16289,3,If we only billed 4 power used why in the world R U billing us estimate of what our bill should have been & then “crediting” afterwards!
3692,2,Istoria dr. next to FPL staging area. We need help figuring out why this one road in the center of shore power with 50 homes is dark.
17590,6,went home to power on!!! Thank you!!! Prayers for everybody!!!
4756,2,The came to my neighbor and gave 6 houses power and left still dont have power what are u guys doing
13072,2,have u begun restoring power in broward county
9886,2,A better story would be  leaves residents witout power for days on end #HurricanIrma
24110,1,"Please post pics of this ""significant"" damage done to Pinellas park so I can understand"
7970,4,no power in Boca del Mar still. 86f inside apt. What is going on???????
1426,6,Kudos to  for their extraordinary response after #IrmaHurricane . 5 million people's power restored in one week. Unprecedent.
25353,3,how come rick neighborhood across the street from me and all rick friends I know have power but poor don't . Criminal !!
5367,6,I got the power!power! Thanks ppl for helping my city!
10541,4,Has power been restored to Pompano Beach area
6926,6,Thank you to everyone at FPL & out of state! We're out of power but know you're working hard! Thank you and stay safe!
25047,2,No powers until Friday at midnight
27755,2,you wont give me power back no balls
22800,4,"My neighbors across the street got their power today, but everyone on my side is still out. Doesn't make any sense!!! I'm in Mount Dora"
13542,4,Please help in the village green area! Need power
19685,1,Quick summer storm. Lock step dim wits. Get the power handled!
11395,6,Power in some areas was restored early this morning. Thank you  for the commitment to aid residents during tough times.
15999,4,tree on power line on Western Way
16847,4,Pinellas does not all have power. My damage is due to Irma and has not been fixed. What does it take? How can I get my family home?
