ID,Manual Coding,Tweet
12963,2,I don't even know why my power went out it wasn't even that bad here
13096,2,Sweating worse than a day at Disney. #hurricaneimra #nopower #sweatshop #ineedAC #disney #florida #hurricane
13430,4,"miami gardens, florida 33056 ! we need power !!"
7138,2,how is it that 50blks of us has power except for my block???? We have special needs we've called & FPL doesn't care WTF!!!!!!
10540,2,Still no power but good to see some of the houses around me with electricity. #sliverofhope #hurricaneirma
20783,5,Just want to give you guys some hope. My family lives in Parkstone off 434 and got power a few hours ago. Hang in there!
1396,2,"We just lost power for our whole block. Wth  ? If I have to throw out anything in my fridge we just filled up, I’ll be very upset."
1112,2,I've been patient  but its DAY 12 WITHOUT POWER & my family is struggling!!! Please help!!!!
6155,1,Your app is BS. See trucks driving by our neighborhood none stop to repair the 145 homes you say don't have power.
12936,6,Thanks  for restoring my power within hours of it going out! #HurricaneIrma
21833,2,how come when I report my issue with you guys about my power being out do you guys tell me there is no outages when there is.
5801,5,"Yay, I hope you all get the help you need. Hurricane victims are in my prayers."
26779,2,"We can understand Naples. I am in Dr Phillips, Orange County! There is barely any significant damage, yet they are still ""assessing"". Joke!"
2798,8,fyi. Reporting might be off. Website states we have electric but our entire complex 86 units still has no power
16167,1,"“Defend the sacred,” “water is life,” “people over profits,” “Utilities Commissioners, do you hear us?” all chanted ahead of the meeting."
6764,2,where my electricity at
4940,5,"FakeNews: #indicate damage that needs long repairs, instead of misinfo volunteer  until power restored #sharingiscaring"
26406,2,CAN YALL GIVE US POWER DAMMIT
9061,2,52 hours without power
27931,8,Official with  says 500 workers will be coming to Pinellas County today to help restore power
12257,2,This is ridiculous everybody around us has power ! But we don't people have power next development over we don't fix this .
27455,5,My mom is Pinellas park and she told me she just got power. I'm hopeful
23520,1,Give me a break they had a thunder storm
17949,1,Good thing it sprinkled in Largo now you can blame the weather insteam of your lying
8414,4,our neighborhood has most house with power except two blocks please help on 67th street SW 156th Court. No restoration date!
4291,1,"Stop fighting solar! We could be ok if we had solar panels! Day 6 NO POWER, no damage, no flooding! 33919"
7853,4,FYI technician came by and they said the crossbox has no power. So you contact  to get it fixed or do I?
26422,2,how about some positive news? Tell us how many have gotten power restored! Give people some hope!
16484,2,putting Vegas over/under odds on if you get my power back on by 11pm I'm going with the over
457,1,Still nothing as of 9/18  :30am. And I'm not in the major damage areas. What's going on?
7789,5,Just got mine back. Praying for a quick restoration to all still with no power. We need better system  .
2020,1,"Lamenting lack of power, cable or internet, as if somehow special snowflakes are ignored on purpose, is irresponsible entitlement nonsense"
3877,2," can you do something regarding my power? It's been 8 days w/o it.  trucks pass by my street to ""see"" but don't fix!!"
5017,2,I have been without power since Saturday night and the entire neighborhood got power but not the block where I live at.
14080,1,Not a drop of rain or a squall. Our windows are open because of how hot it is without power and yet here we are 4 hrs no power.
24131,2,Sleeping naked and afraid tonight since we still ain't got any power smh  y'all needa tighten up
12833,2,"Ok,  We're ready to have the power back."
11842,2," question I have limited power in my house, is that part of the restoration process of power? Thanking you in advance."
19374,,"I say storm the Bastille, drag the King out from his palace, and start Robespierre-ing some fuckers"
7319,2,Repair trucks have came and gone and left many of my neighbors and myself without power ?
15135,8," Power is out now at Delaney park, 614 Florida Street"
8525,6,My power was on for about 5 seconds. Bless  for working hard.
15824,5,"And your pets, they'll get sick too, or bring it back into where they're living boil everybody's water be safe"
11719,6,thank u so much!! amazing work ! i got power this am. yall killed it
24848,6,Best part about getting off of work soon?? Apparently I'm going home to a house with power!!!!!! Thanks  !!!
4783,1,"In 04' trees were down everywhere in my city, power back in 3 days. This time no trees down, and going on a week with no power."
13224,,"Yeah, he's been so busy passing no bills he can't find time to help constituents facing a med. emergency. It's Obama's and her emails fault."
626,4,any idea when they will be resetting the breakers on Lake Miriam Dr. It would restore power to a lot of homes.
25983,6,We came home this morning to find electricity! Thank you so much for the speedy recovery! Thanks  for hard work after storm!
1131,1,now I'm sure FPL will do what you promised after hurricane Wilma! u had 12 years & did very little. even pro active tree trimming stopped.
21488,4,"Thank you, still waiting on power with a lot of elderly in my neighborhood!! #FL #Irma #maitland"
1386,2,is it possible for you guys to get your shit together? Obviously not. Only had power back for a couple days. Now we're out again
12142,2,Drove around. Surrounding area has power. What the fuck  ???
4450,6,you guys did an outstanding job restoring power in Florida
1154,2,"Really?  ticket just keeps delaying, now nearing 2 weeks with no power! No FPL crew onsite at all.  "
19152,2,Dawn breaks on #HurricaneIrma Day6 without  power in Dunedin FL. Crews rolling again while my Generac keeps humming - Be Safe
11425,6,I am so blessed to have you as my power company. Praying for the safety of your workers out returning our power! Thank you!
13920,2,And my power went out wayyyy to early so I'm gonna need a discount this month
8954,2,When will the rest of Bravard County get power??
17565,2,"I feel so special being one of the 20,000 left without power in Orange County "
1420,6,Passing so many power trucks tonight heading back to the staging areas. Thankful for their hard work over the last week!
16265,2,Crews came and and cut the trees off lines. They also cut a line and left it on the ground and in the trees. Can we remove it?
5884,2,I don't understand how I have no power but the neighbors to the left and right of me have power
3636,2,Still no power at home in Indian Beach/Sapphire Shores #Sarasota #IrmaRecovery
24392,2," can we get power in tangerine fl, I ain't work for y'all for a year and a half to be out of power for this long g."
8592,2,"Full of shit, i havent even seen a truck accessing the damage let alone trying to fix anything"
25258,6,Every single person updated on their individual status when 1.2 million have lost power. It's not how it works. Everyone needs to chill out.
7923,2," Our whole complex has power except 3 buildings. Please restore our power at The Waves in Plantation. Buildings 1, 2 and 3."
17687,2,Why are we always last to get power back?If we are on a low priority grid and always out the longest then we should pay less #dukenopower
17429,4,"Citra fl still without power, I still have lines in my yard, I'm on disability and it's hard to get in my yard, 1631 ne 180 st. Citra fl."
1002,6,Some solar panels and my storm surcharge money back basically haha. I appreciate it though
25467,2,- I'm getting real sick of everyone around me getting their power restored! #WTF no damage on Dean so why no power?
1499,4,"Are the lift stations still on generators? My sidewalk keeps flooding with soapy looking water, but we haven't used dishwasher or laundry."
23280,2,I had power but lost it last night :( why????? Bring it back
9699,2,"I know they are busy and trying hard, but  turned on power to every street except for my side. They sat there. Teases. :-)"
19014,1," your map is WRONG. Not only do we NOT have power, your voicemail box is full & your website is overloaded. We CAN'T report. "
2502,2,Yall are ridiculous lol its literally been a week and my nieghbors around me have power but I dont & trucks have pass my house
21024,2,"So... looks like I'm part of the special group in Pinellas that's going to get power back at 11:59:59 tomorrow, huh,  ?"
18264,3,"Hey,  , this seems like possible price-gouging /criminal behavior. Please look into this  -  wfla.com/2017/09/15/tar get-8-duke-energy-billing-shocks-power-customers/ …"
8823,2,Same in our area - fpl rep claimed they were routing the power to another area.
27683,6,Come on  I believe in you! You can get this power back on!
3672,2,Day 8 of no power and no  trucks
16467,2,"Today's the day! Tonight by 11pm we will have power, right  #10daysnopower"
21356,2,"I seriously need  to come to the aid of 1,511 residents without power in Altamonte Springs on Jamestown. Going on 5 days"
1742,2,10 days with no power! it has been brutally hot! Thank goodness for the crew that restored our power today..
18243,2,Many people through Winter Park and Maitland still without power. Your current outage map doesn't show it
2090,8,"For those  customers in Sarasota County without power, FPL can be reached both in person and by phone. Details: "
24242,2," Post storm, can we get an assessment to determine why our area is always last for restoration of services?"
20667,2,"Still no power in south Saint Prtersburg, 7 days and counting despite having over 12 Duke related trucks less than a block from my house"
7863,2,you need to come & clear the streets  needs to restore my neighbors power and can't because the trees are in the way.
13734,2,"Hats off to  , wind blowing pretty hard, we still have power."
15267,6,WE HAVE POWER! Thank you to the hard working team at  and the leadership of  . Our furry dog will be so happy!  – bei San Marco
3391,6,Power is finally back! Thanks
2119,8,FUN FACT: Homes in Golden Gate Estates can't have water without electricity.
1701,2,10 days without power and counting #afterirma #FPLOutage
14484,6,Power is back on after #HurricaneIrma ! Thanks for working so hard
6088,2,How do you explain entire neighborhoods with power except one section. Never seen that beg. Your team needs to fix this shit
5451,2,"I'm one of the lucky 75 l on my 1800-customer part of the  grid that didn't get power restored, so now I'm probably last in line."
17228,2,"Charlie, here is your chance to show up  and his  cronies. Help restore power faster!"
18834,2,you plan on fixing this anytime soon? Maybe help out the neighborhoods on Jamestown in Altamonte Springs w/o power?
14896,4,when will power be restored in kissimmee #irma
21287,2,Most of the neighborhoods around me have power... But my neighborhood has no power. Please Turn The Power On. 32703 Apopka FL
19278,2,"I've seen repairs for category 5 Hurricanes made MUCH faster than this. They didn't spend 3 days ""assessing"" damage before working either."
2636,2,falsely claiming power was restored when it wasn't and still hasn't been. Received this several days ago and still no power.
12513,6,just got power love u
9749,2,when is your website going to work  even the app doesnt work. i just want to see when my power is going to come back on.
20459,2," Reportd lines down 5 days ago at vet hosp + neighborhood still no power. Dangerous! Lemon & W Fort Dade, Brooksville "
2734,2,Third world islands are restoring power faster than
1544,8,We can't touch the tree according g to them. Power was out before storm even hit Cuba. They are saying it's a cause if a main line since sat
1014,5,"If you can DM name/cell too. Not sure we have reporter doing power story for late, but if they do, would be good to have contact info."
25933,8,my bank account has an outage. I will be assessing the damage. It may take a week for you to get an update.
2724,1,if  charges me for September. I'm just gonna knock down all the power lines again.
6715,3,Fpl made 2.8 billion profit in 2016 yet we had to pay to recoup storm damage? Gonna restore Your equipment with your profit this year?
20823,2,Pinellas county is supposed to have power back by midnight tonight. It's 10:38. I don't feel confident #dukeenergysux
18290,3,Seriously is there a secret deal where  gets you power in short order in exchange for you not saying anything bad about them?
17525,3,"#DukeEnergy lies saying that customers power has been restored, so that they look good on the news."
4110,2,I'm in the same shitty boat. No power since Sunday at noon
18586,8,"Winter Park, FL without power still!"
17003,2,Well  - it is midnight and still powerless in Volusia. Not just #DukeEnergyFAIL but a COLOSSAL FAILURE!!!!! Fix our power!
24123,3,"As am I. If this was just storm related issue, and not a repeated problem w/  I might be less venomous. But thanks for your 0.10."
5318,6,Power came on.  thank you. I did hear some streets lose power when it was turned on.
10674,,in Miramar without power
20862,6,"5 days without power and its finally on, thanks "
20445,2,"I got trees touching the power lines and duke aint cutting the trees, im fixing to cut it down for them. Why cant they cut them down?"
2861,2,Why does my ticket change the number of affected customers from 1600 to 43 to 1582 to 9 to 41? Only accurate info is no power
2348,,"Many thanks to  as mins before the 18:30#WorldMeditationHour today, the meditation center  got back to full power! "
14498,6,"Thank you for fixing this and restoring power last night, you all ROCK!! I believe this was the calvary "
15171,8,"A #drones partnership among  ,  and  restored power in Jacksonville after #Irma .  uasmagazine.com/articles/1750/ drones-help-restore-power-in-jacksonville-after-hurricane-irma …"
8499,1,told 8 days without power. Can you imagine if it had been a direct hit? Florida needs a different power company.
22431,2,please come fix my power - 4 going on 5 days & haven't even seen a Duke truck in sight. my patience is running thin.
27454,2,4500 crews doing nothing bet you made sure your houses had power
12303,4,FPL  Sep 10. hey FPL what about an update on Manatee County power restoration. #Irma
10512,8,".  CEO: Company has 4,500 working in  2 restore power - Part of 19,500 working throughout the State.  – bei MDFR Headquarters and Training Center"
3296,2,"What a lie!!! We were told power would be restored by Sunday, yesterday they changed it to Tuesday!"
6907,5,"Sorry, so excited, but a little selfish!! Do You and you Family have power. If not we now have room in our freezer ha haaa."
12505,6,Shoutout to  for restoring our power already. Got the damn generator set up and then power comes on. #Blessed #AfterIrma
18819,8,I understand that everyone in my neighborhood has power execpt 8 rows of houses between murphy & champlain but us do all or do none #Deltona
24231,2,can you explain how only 3/4 of my apt complex got power back. and not a truck insight working on my side?. 7 hrs ago. fix this
19588,2,Power is a need in Florida. You can't survive without it. I don't know if I can go to bed in a puddle of my own sweat once more.
3355,6,"Thank you,  for restoring my power, minutes ago! #IrmaHurricane #Irma #IrmaRecovery #IrmaFlorida"
19613,8,My work doesn't have power yet but I saw 5 FPL trucks in the vicinity when I went there earlier
27389,,So proud of our team working on #industrial #water #research for  . Great job today at #2017symp !
3863,,"How about an act of man, like insufficient vegetation management around power lines and utility poles?"
13098,6,Thanks for tha hard work! Any update on West Boca parents have been with out power 27hrs & counting.
6290,8,After #IrmaHurricane :  : x #of customers out of power. Regular updates with numbers. Expected restoration date.  :
145,4,"I would like to know when is gonna be restored the power at 2735 North Poinciana Blvd in Kissimmee, zip code 34746. We still without power."
20125,2,had my area marked as restored when we weren't... still no sign of power coming anytime soon...
21909,6,Thanks to all of your linemen! We really take things for granted when we don't have them. Working hard everyday for our power
26832,6,thank you for restoring our power!!
15839,2,Yeah this getting ridiculous. Some of us work from home. No power =No work No work=no pay for all that manpower it sure seems like a waste
2032,1,No email updates and zero communication about power restoration
11720,1,You'd figure that they would have been coordinated with each other since they knew ahead of time a hurricane was coming.
4888,2,Day 6 and still no power
7759,2,We have been with out power. And no one answers the phone fpl
1592,2,"In response to lawsuits,  blames  lush trees for difficulties with restoring power.  "
110,6,Thank you for our power back on from Doris street 34741. Please be safe out there.
8546,2,I Saw 3 Trucks In My Neighborhood Why My Power Still Off ? One of them was on They Phone Chiling
20594,6,Thanks to  & the wonderful guys from NC for getting our power back on yesterday. Feel like I should drop off Krispy Kreme for all
25756,2," I have been without power for FUCKING 2 DAYS NOW, I see where you flipped the switch for the power lines, WTF. >:| "
20078,2," pinellas county is supposed to have power by midnight, can that happen if no one has been to my house to pick up a tree on lines"
11002,2,Looks like I'm sleeping in my car tonight on to day 3 without power
20922,5,How can you let Seminole county water get contanimated? How can we boil water without power? You are the worst.!!
20535,2,updated on Orange county restoration and customers left without power
18773,4,When will power be restored at Sweetwater Springs ? Watercrest Drive Longwood FL 32779 please?
18458,2,Just going to keep reporting it until my power comes on. I'm working nonstop to safely inform you that my power is still out.
6024,,For what ?!? To check her out ?! What we need is power for the a/c and for her device !!
23915,6,"My house isn't in a lake or destroyed, therefore duke can take as long as they like to fix my power. *logic*"
14362,8,Visit  StormCenter for important tips before #HurricaneIrma & after.  fpl.com/storm.html?cid =MC17EN015 …
27179,,OHHHH YOUR POWER!!!! THOUGHT YOU MEANT LIKE SUPERPOWERS
22504,8,"Maggie and my mom's dog. Mom has power, so we got some AC today. "
18930,2,We are one of 240 homes in my entire neighborhood still waiting for power in Maitland. Is Sunday still accurate?
18501,2,what is going on in Deltona? Not a truck for 6 days but we're supposed to believe that we will have power by midnight Sunday?
13041,8,We STILL have power!!!!
3001,3,Why don't u use ur influence 2 get  2 answer customer questions re when power will be back on? We have lives to live.
20966,2,Midnight for my family AM Friday will be 126 hours without power it better be on by Midnight or lawyers and detectives will be
21156,3,"  when my son has an emergency, who do I sue? Real feel was 100 today. Duke don't do nights."
11635,6,"Thank you, thank you!!!!! Power just came on."
17971,2,I don't care who restores my power I'll be grateful for them. So I guess my midnight deadline for power tonight isnt gonna happen? But when?
6956,2,Dude I NEED POWER. LIKE COME ON
21243,2,wish we were one of them. Saw a white duke energy pickup truck today. Does that mean we may have power tomorrow
89,6,Great job KUA not only on restoring power so quickly but also for keeping us updated on your progress!
13835,4,"  I've been without power in Savanna in Weston, FL since7:30 am. Is the entire city w/o power?"
1985,2,How about making power cos. Like  do a plan that does not take 7+ days to restore power?
10294,2," you guys suck the house next to me has power but I don't, WHAT?"
20703,2,I hope it's true that the power comes on today because this is bs.  #DukeEnergy #DUKEENERGYIRMAFAILURE #sweatinglikecrazy
18966,2,Still without power in beacon square holiday Fl. Day 6. Plz send the linemen back!
27304,2,a week?! I'm hearing wrong there is minimal damage in Clearwater-Dunedin get us up now.
4634,6,they're waiting? many men & women are out their risking their lives with downed powerlines to fix our power.
19011,4," The map just showed us with power. Lake Cain Hills , Orlando 32819. I called and it said I was the first one. Still 84 out."
5499,2,Stop with the BS we need #power guys are hiding out then they come out at night but when you approach them they jump back in trucks w/ AC
16138,2,When you got a blog post due on your only day off and you lose power. Come on  you got this!
5461,2,Cool story... where is my power
3556,4," OLD people suffering, one hospital just now. Can't relocate. Please get power on 700 block N.W.66th AVE, Plantation, FL. "
12883,2,Slide thru with the power
16629,2,it 4pm and still no one here. The only house on our street without power. It's been more than a week now.
6797,2,you guys must of know I almost died from heat last night the power back on thank you
27817,1,"I feel like it's an infrastructure problem over here.Not the actual storm,it happens in this area w/out damage."
15137,2,are you providing updates on power outages?
21690,6,Prepping rooms for the dedicated people from  who are here to help restore power to our neighborhoods. #FloridaNow
7564,8,"Negative, my friend. No power yet. You guys?"
2231,8,"10 days after the hurricane #Irma Pinecrest FL is a ghost town.  , .  and .  forgot their residents"
13658,8,power is out at PGA National in Palm Beach Gardens.
21255,3,ok  how are u going to tell me online not to report my power outage.....
9157,4,when will power be restored to my area? I'm in West Hialeah
2835,2,"Aka and the sun rises on ANOTHER DAY WITHOUT POWER. Apparently, we're one of the lucky 60,000   ...  fb.me/zVHL7Y3G"
5615,1,when will you start running power lines underground and stop with these stupid poles?! #Irma
17398,2," so we've been without power for 7 days now, I have a 1year old & 3 year old! This is ridiculous! Can you get with  ?"
28161,8,in sure u r aware but no power since 1am In Northwood oaks...53rd and 34th. B safe
16896,4,we still do not have power on Baltimore Dr in the Kingswood subdivision. Crew was out last night then left w/o restoring power.
315,2,"I think it's pretty sad we lost power at 7:10 pm. Wasn't really even bad, probably first out, last one on"
24089,4,This months bill should be very low.. ijs a week with out power ... at least let us know where we can find ice
11724,8,"Same thing in colonial grand at lake Mary, only businesses have power."
17415,3,"well , thats how it is with big providers , but surprisingly they never delay to take the money from you every month ... One week no Power"
27544,2,A week without power? I don't think  would let that happen. #hurricaneirma
8816,4,we need power in North lauderdale
12760,2,It's been 2 days since your last post! When are you planning to restore power service?
19581,2,Including pasco I still don't have power in holiday
17915,4,please come to my house my family cant stand the heat any longer.The rest of my neighborhood has power but us and my neighbors
3567,2," NO, we don't have any power in our home! I understand you guys have your hands full but this is not right! #33168 "
25897,8,my power came back on last night. 1/2 my hood is still w/o power though
11559,6,24 hours after conditions start to improve and we have power. Thank you  !!! I am so relieved I can't even tell you.
2216,2,"How can it take so long to suspect in a damage to your equipment, specially if we see no crews in a large surrounding area? Send someone!"
24683,6,So glad to finally have power back on! Thanks  ! #irma2017
8707,2,I just drove from Salerno Rd to Bridge Rd. Not one truck anywhere. Emergency Response? You've got to be kidding me.
2554,3,"the power tracker is useless. Just says 90% by Monday, 95% by tues & rest by wed."
17017,8,Within a few hours of your post we have power
3756,2,Hey  I still don't have power in Miami. Can you comp me a few nights  until  does their job?
5684,8,33024 Pembroke Pines still needs power. Some houses have power others don't.
228,4,Hopefully you make it to park terrace circle soon. We have elderly and infants that are suffering from the power outage
1625,,calls out  . #Irma  miamiherald.com/news/weather/h urricane/article174101851.html …
7907,6,Keep up the hard work! It's hard being without power but you guys are giving up a lot of your time to help so thanks
5740,2,my grandmother on oxygen has been without power since friday night while people on my street have had power restored smh
3979,2," you fucking lying pieces of shit saying East Coast will have power by Sunday, now my ticket says Tuesday - disgusting. "
21133,2,"ANOTHER LIE! NOT working around the clock! You said it before, only in emergencies do you work overnight. Guess this isn't an emergency."
4018,8,Both to the left & right of us have power. We are going on day 7 - new ticket still says 101 affected... yet lots of have it already.
19939,2,it's a little frustrating seeing everyone around us with 2-3 blocks getting power. Is Orange County still Sunday night?
12740,4,"33032 area has no power, help us plz"
1695,6,.   Leave  alone... They did a great job with restoring power. Much improved since Wilma.
5428,8,neighbor got hauled away in an ambulance today. People at either end of the street have power except the few in between.
19156,8,i still no power largo fl.
16747,2,This is spot on lol. 8 days without power or water. Come on  mama needs a hot shower & to cook. #HurricaneIrma
8374,2,Can't sleep b/c all I want in life is power and this is just making me more frustrated that the website doesn't work #saveme
